,Q,A,Unit
202,"What is a GRU, and how does it differ from an LSTM?","A GRU (Gated Recurrent Unit) is a type of RNN that is similar to an LSTM but with a simplified architecture. GRUs have only two gates (reset and update gates) instead of the three gates in LSTMs, making them computationally more efficient while still capturing long-term dependencies.",3
203,How does the update gate in a GRU function?,"The update gate in a GRU controls the extent to which the previous hidden state is carried forward to the next time step. It combines the functions of the input and forget gates in an LSTM, determining how much of the past information to retain and how much of the new input to incorporate.",3
204,What are the advantages of using GRUs over LSTMs?,"GRUs offer several advantages over LSTMs, including a simpler architecture with fewer parameters, which leads to faster training and less computational complexity. GRUs often perform similarly to LSTMs but with greater efficiency, making them a good choice when computational resources are limited.",3
205,"What are Mel-Frequency Cepstral Coefficients (MFCC), and how are they used in speech processing?","Mel-Frequency Cepstral Coefficients (MFCC) are features extracted from audio signals that represent the short-term power spectrum of sound. They are widely used in speech and audio processing tasks, such as speech recognition, because they effectively capture the characteristics of the human voice by modeling the human ear's perception of sound frequencies.",3
206,How are MFCCs calculated from an audio signal?,"MFCCs are calculated by first converting the audio signal into the frequency domain using the Fourier transform. The resulting spectrum is then mapped onto the Mel scale to simulate the human ear's frequency perception. The log of the Mel-scaled spectrum is taken, followed by applying the Discrete Cosine Transform (DCT) to obtain the MFCCs, which represent the audio signal in the cepstral domain.",3
207,What is a Perceptron?,"A Perceptron is a type of artificial neuron and the simplest form of a neural network used for binary classification tasks. It consists of inputs, weights, a bias, and an activation function. The Perceptron makes decisions by computing a weighted sum of the inputs and passing the result through the activation function to produce an output.",3
208,How does a Perceptron work?,"A Perceptron works by taking multiple input values, multiplying each by its corresponding weight, and summing them up. A bias is added to this sum, and the result is passed through an activation function (usually a step function). The output is a binary value (0 or 1) that represents the classification decision.",3
209,What is the activation function in a Perceptron?,The activation function in a Perceptron is typically a step function (also known as the Heaviside function). It outputs 1 if the weighted sum of inputs is greater than or equal to a certain threshold (often 0) and outputs 0 otherwise. This function allows the Perceptron to make a binary classification.,3
210,What is the role of weights in a Perceptron?,"The weights in a Perceptron determine the influence of each input on the final output. During training, the weights are adjusted to minimize the classification error, allowing the Perceptron to learn the relationship between the input features and the target labels.",3
211,"What is the bias term in a Perceptron, and why is it important?","The bias term in a Perceptron is an additional parameter that is added to the weighted sum of the inputs before applying the activation function. It allows the activation threshold to be adjusted, enabling the Perceptron to shift the decision boundary and improve its ability to classify data.",3
212,What is the Perceptron Learning Rule?,"The Perceptron Learning Rule is an algorithm used to update the weights and bias of a Perceptron during training. It involves adjusting the weights based on the difference between the predicted output and the actual target output, multiplied by the learning rate and the input values. This process is repeated iteratively until the Perceptron converges to a solution.",3
213,What are the limitations of a single-layer Perceptron?,"The main limitation of a single-layer Perceptron is that it can only solve linearly separable problems, meaning it can only classify data points that can be separated by a straight line (or hyperplane in higher dimensions). It cannot solve more complex problems, such as XOR, that require non-linear decision boundaries.",3
214,How does the Perceptron differ from more complex neural networks?,"The Perceptron is a simple, single-layer neural network that can only handle linearly separable problems. In contrast, more complex neural networks, such as multi-layer perceptrons (MLPs), have multiple layers and non-linear activation functions, allowing them to learn and represent non-linear decision boundaries, making them capable of solving more complex tasks.",3
215,What is the decision boundary in the context of a Perceptron?,"The decision boundary in a Perceptron is the hyperplane that separates the input space into two regions, corresponding to the two possible output classes (0 or 1). The position and orientation of this boundary are determined by the weights and bias of the Perceptron.",3
216,What happens if the data is not linearly separable when using a Perceptron?,"If the data is not linearly separable, a single-layer Perceptron will not be able to find a correct decision boundary, and the Perceptron Learning Rule will fail to converge to a solution. The Perceptron will continue adjusting weights without finding a satisfactory separation, resulting in poor classification performance.",3
217,How can the limitations of a Perceptron be addressed?,"The limitations of a single-layer Perceptron can be addressed by using a multi-layer perceptron (MLP) with hidden layers and non-linear activation functions. This allows the network to learn complex, non-linear decision boundaries and solve problems that are not linearly separable.",3
218,Can a Perceptron be used for multi-class classification?,"A single Perceptron can only be used for binary classification. For multi-class classification, multiple Perceptrons can be combined in a one-vs-all or one-vs-one scheme, or a more complex architecture, such as a multi-layer perceptron (MLP), can be used.",3
219,What is the effect of the learning rate in the Perceptron Learning Rule?,"The learning rate in the Perceptron Learning Rule controls the step size at which the weights are updated during training. A high learning rate can cause the Perceptron to overshoot the optimal weights, while a low learning rate can lead to slow convergence. Proper tuning of the learning rate is essential for effective training.",3
220,How does the Perceptron handle linearly inseparable data?,"The Perceptron cannot handle linearly inseparable data effectively because it is limited to finding linear decision boundaries. For such data, a single-layer Perceptron will not converge to a correct solution. To handle linearly inseparable data, more complex models, such as multi-layer perceptrons or kernel methods, are needed.",3
221,What is the history and significance of the Perceptron in AI?,"The Perceptron was introduced by Frank Rosenblatt in 1958 and is considered one of the earliest models of artificial neural networks. It marked a significant milestone in the development of machine learning and AI, demonstrating that machines could learn from data. However, its limitations in solving non-linearly separable problems led to the development of more advanced neural network architectures.",3
222,What is a Time Series?,"A time series is a sequence of data points collected or recorded at successive points in time, usually at uniform intervals. Time series analysis involves understanding the underlying patterns (such as trends, seasonality, and cyclic behavior) to forecast future values.",3
223,What is ARIMA in time series analysis?,"ARIMA stands for AutoRegressive Integrated Moving Average. It is a popular statistical model used for time series forecasting. ARIMA models combine three components: AutoRegressive (AR), Integrated (I), and Moving Average (MA), to model different types of temporal patterns in the data.",3
224,"What does the AR term in ARIMA stand for, and how does it work?",The AR (AutoRegressive) term in ARIMA refers to a model where the current value of the time series is expressed as a linear combination of its previous values (lags). The order of the AR term (denoted as p) indicates the number of lagged values used in the model.,3
225,"What does the MA term in ARIMA stand for, and how does it work?",The MA (Moving Average) term in ARIMA refers to a model where the current value of the time series is expressed as a linear combination of past forecast errors. The order of the MA term (denoted as q) indicates the number of lagged forecast errors included in the model.,3
226,"What does the I term in ARIMA stand for, and what is its purpose?",The I (Integrated) term in ARIMA refers to the differencing of the time series to make it stationary. The order of differencing (denoted as d) is the number of times the data is differenced to remove trends and achieve stationarity.,3
227,What is meant by a stationary time series?,"A stationary time series is one whose statistical properties, such as mean, variance, and autocorrelation, remain constant over time. Stationarity is a key assumption in many time series models, including ARIMA, as it simplifies the modeling process and leads to more reliable forecasts.",3
228,"How do you identify the appropriate values of p, d, and q in an ARIMA model?","The values of p, d, and q in an ARIMA model are typically identified through exploratory data analysis, including examining plots such as the Autocorrelation Function (ACF) and Partial Autocorrelation Function (PACF), performing unit root tests (like the Augmented Dickey-Fuller test) to determine the need for differencing, and using model selection criteria like AIC (Akaike Information Criterion) or BIC (Bayesian Information Criterion).",3
229,What is the difference between ARIMA and SARIMA?,"ARIMA models are suitable for non-seasonal data, while SARIMA (Seasonal ARIMA) extends the ARIMA model to handle seasonal data by incorporating additional seasonal terms (seasonal AR, seasonal differencing, and seasonal MA). SARIMA is used when the time series exhibits a repeating seasonal pattern.",3
230,"What is overfitting in the context of ARIMA modeling, and how can it be avoided?","Overfitting occurs when an ARIMA model is too complex, with too many parameters, and fits the noise in the training data rather than the underlying pattern. This leads to poor generalization on new data. Overfitting can be avoided by using model selection criteria like AIC or BIC, cross-validation, and ensuring the model is as simple as possible while still capturing the essential patterns.",3
231,How do you evaluate the performance of an ARIMA model?,"The performance of an ARIMA model can be evaluated using various metrics such as Mean Absolute Error (MAE), Mean Squared Error (MSE), Root Mean Squared Error (RMSE), or Mean Absolute Percentage Error (MAPE) on the test dataset. Additionally, residual analysis is performed to check for any patterns in the residuals that indicate model inadequacy.",3
232,"What are residuals in ARIMA modeling, and why are they important?","Residuals are the differences between the observed values and the values predicted by the ARIMA model. They are important because analyzing residuals helps assess the adequacy of the model. Ideally, residuals should resemble white noise (i.e., they should be normally distributed with a mean of zero and no autocorrelation), indicating that the model has captured all the patterns in the data.",3
233,Can ARIMA be used for non-stationary data?,"Yes, ARIMA can be used for non-stationary data by applying differencing to the data (the I component of ARIMA). The differencing process transforms the non-stationary data into a stationary series, which can then be modeled using the AR and MA components.",3
234,What are some limitations of the ARIMA model?,"Limitations of the ARIMA model include its assumption of linearity, its requirement that the data be stationary, and its difficulty in handling complex, nonlinear relationships in the data. ARIMA is also less effective with long-term forecasting, especially if the underlying patterns change over time. Additionally, selecting the correct values for p, d, and q can be challenging.",3
235,What are some common applications of ARIMA models?,"ARIMA models are widely used in various applications, including economic and financial forecasting (e.g., stock prices, GDP, inflation rates), sales forecasting, demand forecasting, weather prediction, and any other domain where understanding and predicting future values of a time series is important.",3
236,How does seasonal differencing work in a SARIMA model?,"Seasonal differencing in a SARIMA model involves subtracting the value of the time series from the value at the same point in the previous season. This operation removes seasonal trends and cycles, making the data stationary with respect to seasonality. Seasonal differencing is performed in addition to any non-seasonal differencing.",3
237,What are the primary improvements that VGGNet introduced over AlexNet?,"VGGNet introduced several improvements over AlexNet, including the use of smaller receptive fields throughout the network, such as 3x3 convolutional layers instead of the larger 5x5 used in AlexNet. This design choice allowed for increased non-linearity and reduced the number of parameters, making the network deeper and more efficient.",4
238,How does GoogLeNet reduce the number of operations compared to traditional convolutional layers?,"GoogLeNet introduces the concept of a 1x1 convolutional layer, which acts as a bottleneck layer. This layer significantly reduces the number of operations required by first reducing the depth (number of channels) before applying larger convolutional filters, leading to a reduction from 120 million to 12.4 million operations in the example provided.",4
239,"What is the vanishing gradient problem, and how do ResNets address it?","The vanishing gradient problem occurs when gradients diminish as they are propagated backward through deep networks, making it difficult to train the earlier layers. ResNets address this issue by introducing skip connections, which allow gradients to flow directly through the network, thereby preventing them from vanishing and enabling the training of much deeper networks.",4
240,What are the key factors to consider when choosing a CNN architecture for production?,"When choosing a CNN architecture for production, key factors include accuracy, model complexity, memory usage, computational complexity, and inference time. It's important to balance these factors according to specific production constraints and the desired performance metrics.",4
241,What is the relationship between model complexity and memory usage in CNNs?,"There is generally a linear relationship between model complexity and memory usage in CNNs. As the complexity of the model increases, so does the amount of memory it requires, making it crucial to consider this trade-off when designing or selecting a network for a specific application.",4
242,What are the challenges in finding the global minima during training of deep neural networks?,"The challenges in finding the global minima include encountering saddle points, where the gradient is a local minima in one direction and a local maxima in another, cliffs where the gradient is too high, and plateaus where the gradient is almost zero. Additionally, the vanishing gradient problem and exploding gradients can make it difficult to find the global minima.",4
243,How does Gradient Descent with Momentum improve the optimization process in neural networks?,"Gradient Descent with Momentum improves the optimization process by accumulating momentum from previous gradients, which helps the optimizer to continue moving in the same direction even if the gradient is small. This helps the model to escape local minima and reach the global minima more efficiently by preventing the optimizer from getting stuck in shallow minima or saddle points.",4
244,What is the purpose of learning rate scheduling in training neural networks?,"Learning rate scheduling is used to adjust the learning rate during training, typically by reducing it according to a predefined schedule. This helps in stabilizing the training process and allows the model to converge more effectively. Common learning rate schedules include step decay, exponential decay, cosine decay, and reducing the learning rate when the performance plateaus.",4
245,What is the concept of Dropout as a regularization technique in neural networks?,"Dropout is a regularization technique where during each training iteration, individual neurons are randomly ""dropped out"" with a certain probability, meaning their contribution is ignored in both the forward and backward passes. This forces the network to learn more robust features, as it cannot rely on any particular neuron being present, which helps in preventing overfitting.",4
246,How does weight initialization affect the training of deep neural networks?,"Proper weight initialization is crucial as it impacts the convergence of the training process. Poor initialization, such as setting all weights to zero, can lead to neurons learning the same features and hinder the learning process. Common strategies include random initialization using Gaussian distribution, Xavier initialization, and Kaiming initialization, which help in setting the initial weights such that they facilitate effective gradient flow during training.",4
247,How much GPU RAM is required to store a model with 1 billion parameters using 32-bit precision?,Storing a model with 1 billion parameters using 32-bit precision requires 4GB of GPU RAM.,4
248,"What is the GPU RAM requirement for GPT-3, which has 175 billion parameters? ",GPT-3 requires 700GB of GPU RAM just to store the model.,4
249,What happens to storage requirements when converting to 16-bit (FP16) precision?,"Converting to 16-bit (FP16) precision halves the storage requirements, reducing it to 2 bytes per parameter.",4
250,What additional storage is needed when training a model beyond just the model parameters? ,"Additional storage is needed to store optimizer states, gradients, activations, and temporary variables.",4
251,What is Low-rank Adaptation (LoRA) in the context of model fine-tuning? ,"Low-rank Adaptation (LoRA) involves decomposing the weight matrix into a product of two smaller matrices, typically aiming to reduce the rank of the attention weight matrices.",4
252,What are the limitations of Parameter-Efficient Fine-Tuning (PEFT)?,"PEFT struggles to match the performance of full fine-tuning, doesnt make inference more efficient, doesnt reduce the cost of storing large models, and requires full forward and backward passes.",4
253,What is the purpose of scaling factor (??) in LoRA?,The scaling factor (??) is used to scale the low-rank matrices during the adaptation process in LoRA.,4
254,What are the two matrices used in LoRA for weight matrix decomposition? ,The two matrices used in LoRA are matrix ?? (?? ? ??????) and matrix ?? (?? ? ??????).,4
255,What is an example of a task that a decoder-based language model would perform? ,"An example is predicting the next token in a sequence based on previous tokens, such as predicting dog in the sequence the quick brown fox jumps over the lazy ________.",4
256,What is a significant challenge mentioned in the document when using pure 16-bit floating-point neural networks? ,"A challenge is the need for additional storage for optimizer states, gradients, and other variables during training, despite the reduced model storage from 16-bit precision.",4
257,"What is RAG, and how does it work?","RAG (Retrieval-Augmented Generation) is a framework that retrieves relevant information from a knowledge base and then generates a response by combining this retrieved information with a prompt. It typically involves three steps: retrieval, augmentation, and generation?(LangChain_RAG).",4
258,What is the purpose of LangChain?,"LangChain is an open-source framework designed for developing applications powered by Large Language Models (LLMs). It focuses on creating complex projects by composing modular components like document loaders, chains, agents, and more?(LangChain_RAG).",4
259,What are the main components of LangChain?,"The main components of LangChain include models (LLMs, Chat Models, Text Embedding Models), prompts (Prompt Template, Output Parsers), chains (sequential or complex chains), agents (for tool interaction), and indexes (document loaders, text splitters, vector stores)?(LangChain_RAG).",4
260,How does LangChain handle document loading?,"LangChain uses document loaders to load documents into its own Document object. These loaders might require additional libraries (e.g., pypdf for PDF loading). LangChain also supports integrations with third-party sources like Google Cloud and Wikipedia?(LangChain_RAG).",4
261,What is a Prompt Template in LangChain?,A Prompt Template in LangChain is an abstraction that allows the reuse of well-structured prompts in sophisticated applications. It helps in managing and organizing prompts that might be long or detailed?(LangChain_RAG).,4
262,What is the role of agents in LangChain?,"Agents in LangChain are powerful components that use models, data connections, chains, and memory to perform tasks. They can interact with external tools, APIs, and data stores to reason through requests and take actions based on observational outputs?(LangChain_RAG).",4
263,What is the Maximum Marginal Relevance (MMR) algorithm?,The Maximum Marginal Relevance (MMR) algorithm is used to choose the most relevant and diverse responses from a set of retrieved chunks. It helps in selecting the best information to augment the query?(LangChain_RAG).,4
264,What are some challenges LLMs face according to the document?,"LLMs face challenges like not being up-to-date, lacking domain-specific knowledge, and struggling with real-time information. They also have limitations in handling complex calculations and may produce hallucinations or plausible but incorrect information?(LangChain_RAG).",4
265,How does LangChain address the limitations of LLMs?,"LangChain addresses LLM limitations by integrating them with other tools, allowing them to access real-time data, specialized knowledge, and perform specific tasks through the use of agents and external tools?(LangChain_RAG).",4
266,What is the significance of iterative prompt development?,Iterative prompt development involves refining prompts based on analysis of the results. It is crucial for improving the accuracy and relevance of the outputs by making the model spend more computational effort on complex tasks,4
267,What is the main drawback of one-hot encoding in representing word meanings in neural networks?,"One-hot encoding results in a large and sparse embedding matrix with dimensions equal to the vocabulary size, which cannot effectively capture word meanings.",4
268,"What is Word2Vec, and on what data was Google's pre-trained Word2Vec model trained?","Word2Vec is a model that provides 300-dimensional word vectors, and Google's pre-trained Word2Vec model was trained on approximately 100 billion words from a Google News dataset.",4
269,How does Byte Pair Encoding (BPE) handle rare words in the GPT-2 model?,"In GPT-2, rare words are decomposed into meaningful subwords using BPE, which helps the model to understand them better.",4
270,What problem does SentencePiece address in subword tokenization methods?,SentencePiece addresses the problem of languages that do not use spaces to separate words by including the space character in the set of tokens used for building vocabularies.,4
271,What is a key feature of the Transformer architecture introduced by Vaswani et al.?,"A key feature of the Transformer architecture is the use of self-attention and multi-head attention mechanisms, without any recurrent connections.",4
272,What is the primary difference between the OpenAI GPT and BERT models?,"The primary difference is that GPT uses a left-to-right Transformer, whereas BERT uses a bidirectional Transformer that is jointly conditioned on both left and right contexts.",4
273,What is the purpose of the multi-head self-attention mechanism in Transformers?,"The multi-head self-attention mechanism allows the model to focus on different parts of the input sentence when processing each word, improving the model's ability to capture complex relationships.",4
274,What task is primarily used during the pretraining of GPT models?,"The primary task used during the pretraining of GPT models is language modeling, where the model is trained to predict the next word in a sequence.",4
275,What limitation is associated with GPT-3 regarding its model structure?,"A limitation of GPT-3 is that it is not bidirectional, which means it processes text in a unidirectional manner, potentially missing out on context that could be gleaned from both directions.",4
276,How does BERTs architecture differ in terms of pre-training tasks compared to GPT?,"BERTs architecture is pre-trained using two tasks: Masked Language Modeling (MLM) and Next Sentence Prediction (NSP), while GPT focuses solely on the task of next word prediction.",4
