,Q,A,Unit
119,`Why is it important to consider both precision and recall in model evaluation?,Considering both precision and recall is important because they provide insights into the model’s performance in terms of both the relevance of the results (precision) and the ability to capture all relevant instances (recall).,2
120,`What is underfitting in the context of model fitting?,"Underfitting occurs when a model is too simplistic and fails to capture the underlying patterns in the data, leading to poor performance on both training and testing datasets.",2
121,`What are some common reasons for underfitting?,"Common reasons include a short training period, a simplistic model, and a lack of enough features.",2
122,`What is overfitting in machine learning?,"Overfitting happens when a model learns the noise in the training data instead of the actual patterns, resulting in excellent performance on the training data but poor generalization to new data.",2
123,`What are some indicators of overfitting?,Indicators include high training accuracy but low testing accuracy.,2
124,`How can overfitting be detected?,Overfitting can be detected by comparing the model’s performance on training and testing datasets.,2
125,`What are some strategies to prevent or reduce overfitting?,"Strategies include training with more data, reducing or removing features, early stopping, regularization, and ensembling.",2
126,`What is regularization in the context of model fitting?,Regularization is the process of adding additional information to prevent overfitting by penalizing complex models.,2
127,`What are some common regularization techniques?,Common techniques include L2-norm (Ridge Regression) and L1-norm (Lasso Regression).,2
128,`What is the purpose of early stopping in training models?,Early stopping aims to halt the training process before the model starts to overfit the training data.,2
129,How does dimensionality reduction help in preventing overfitting?,"Dimensionality reduction helps by reducing the number of features, thereby simplifying the model and reducing the risk of overfitting.",2
130,What is the main goal of Support Vector Machines (SVM)?,The main goal of SVM is to find a hyperplane that best separates the data points of different classes with the maximum margin.,2
131,What is the Kernel Trick in SVM?,"The Kernel Trick allows SVM to perform in high-dimensional space without explicitly mapping the data to that space, using kernel functions to compute the inner products.",2
132,What are some popular kernel functions used in SVM?,"Popular kernel functions include Polynomial, Radial Basis Function (RBF), and Hyperbolic Tangent.",2
133,What is the significance of the feature mapping in SVM?,Feature mapping transforms the data into a higher-dimensional space where it becomes linearly separable.,2
134,How does the SVM handle non-linear data?,"SVM handles non-linear data by transforming it into a higher-dimensional space using kernel functions, making it linearly separable.",2
135,What is the role of the hyperplane in SVM?,"The hyperplane is the decision boundary that separates different classes in the feature space, and SVM aims to find the hyperplane with the maximum margin.",2
136,What is the main goal of Support Vector Machines (SVM)?,The main goal of SVM is to find a separating hyperplane that maximizes the margin between different classes.,2
137,What is the difference between hard margin and soft margin SVM?,"Hard margin SVM assumes that the data is linearly separable and aims to find a hyperplane with no misclassifications, while soft margin SVM allows for some misclassifications by introducing a penalty for violations.",2
138,What is the role of the parameter ( C ) in SVM?,The parameter ( C ) controls the trade-off between maximizing the margin and minimizing the classification error. A larger ( C ) puts more emphasis on minimizing errors.,2
139,What is the dual problem in SVM?,"The dual problem in SVM involves maximizing a quadratic function of the Lagrangian multipliers subject to certain constraints, and it is often easier to solve than the primal problem.",2
140,What are support vectors in SVM?,Support vectors are the data points that lie closest to the separating hyperplane and have a direct impact on its position and orientation.,2
141,How does the kernel trick help in SVM?,"The kernel trick allows SVM to operate in a high-dimensional space without explicitly computing the coordinates of the data in that space, using kernel functions to compute inner products.",2
142,What are some common kernel functions used in SVM?,"Common kernel functions include the linear kernel, polynomial kernel, radial basis function (RBF) kernel, and sigmoid kernel.",2
143,How does SVM handle non-linear data?,"SVM handles non-linear data by mapping it to a higher-dimensional space using kernel functions, where it becomes linearly separable.",2
144,What is the significance of the margin in SVM?,The margin is the distance between the separating hyperplane and the closest data points from each class. Maximizing the margin helps improve the generalization ability of the model.,2
145,What is the role of the Lagrangian multipliers in SVM?,Lagrangian multipliers are used in the dual formulation of SVM to optimize the objective function and determine the support vectors.,2
146,What is Principal Component Analysis (PCA)?,PCA is a dimensionality reduction technique that extracts important information from high-dimensional data and arranges the new dimensions in order of importance.,2
147,What are the benefits of dimensionality reduction?,"Benefits include faster computations, data visualization, noise elimination, reduced risk of model overfitting, and reduced space requirements.",2
148,What are the two main approaches to dimensionality reduction?,The two main approaches are feature selection (selecting the best features or discarding irrelevant ones) and feature extraction (combining existing variables to form new features).,2
149,How does PCA determine the new dimensions?,PCA determines the new dimensions by retaining the direction of maximum variance and ensuring minimal information loss.,2
150,What is variance and why is it important in PCA?,Variance measures the spread of data and is important in PCA because it helps identify the directions with the most information.,2
151,What is covariance and how is it used in PCA?,Covariance measures how much each dimension varies from the mean with respect to each other. It is used to find relationships between dimensions and to compute the covariance matrix.,2
152,What is the covariance matrix?,"The covariance matrix represents the covariance between dimensions as a matrix, where the diagonal elements represent variances and the off-diagonal elements represent covariances.",2
153,What are principal components in PCA?,"Principal components are the directions in which the data shows the largest variation, derived from the covariance matrix.",2
154,What are eigenvectors and eigenvalues in PCA?,"Eigenvectors determine the directions of the new feature space, and eigenvalues determine their magnitude. They are derived from the covariance matrix.",2
155,What is the process of applying PCA to a dataset?,"The process involves computing the mean vector and covariance matrix, obtaining eigenvectors and eigenvalues, and projecting the data points into the new feature subspace.",2
156,What are benefits of CNN over neural network?,"Convolutional Neural Networks (CNNs) offer several advantages over traditional fully connected neural networks, especially when dealing with image data or other grid-like structures. Here are the key benefits:

1. Spatial Hierarchies of Features
Local Receptive Fields: CNNs use convolutional layers to detect local patterns such as edges, textures, and shapes. As you move deeper into the network, these local patterns combine to form more complex features.
Translation Invariance: Features learned by CNNs are more robust to translations of input data. This means the network can recognize an object even if it's slightly shifted within the image.
2. Parameter Efficiency
Weight Sharing: CNNs share the same filter (set of weights) across different regions of the input, drastically reducing the number of parameters compared to a fully connected network.
Reduced Overfitting: The reduced number of parameters in CNNs helps in decreasing the risk of overfitting, particularly when dealing with large datasets.
3. Better Performance on Image Data
Hierarchical Structure: CNNs are particularly well-suited for image data because they naturally capture the hierarchical structure of images (edges → textures → objects).
Automatic Feature Extraction: CNNs automatically learn the most relevant features directly from the input data, eliminating the need for manual feature engineering.
4. Efficiency in Computation
Sparse Interactions: In CNNs, each neuron in a layer is connected only to a small region of the previous layer, making the computation more efficient.
Dimensionality Reduction: Pooling layers in CNNs reduce the spatial dimensions of the data, decreasing the computational load for subsequent layers.
5. Robustness to Noise
Invariance to Minor Changes: CNNs tend to be more robust to small changes or noise in the input, as the convolutional and pooling operations help in smoothing out these variations.
6. Flexibility in Architecture
Custom Architectures: CNNs allow for flexible and diverse architectures (e.g., ResNet, Inception), which can be tailored to specific tasks by stacking different types of layers, such as convolutional, pooling, and fully connected layers.
7. Applicability Beyond Images
Generalization to Other Domains: Although CNNs are most commonly used in image processing, they can be applied to other types of data that have a grid-like structure, such as time-series data (using 1D convolutions) and audio data.
Overall, CNNs are particularly advantageous for tasks where the input data has a spatial or temporal structure, such as images, videos, or sequences.",3
157,What is a Convolutional Neural Network (CNN)?,A Convolutional Neural Network (CNN) is a type of deep learning model designed for processing structured data such as images. It uses convolutional layers to automatically learn and extract hierarchical features from the input data.,3
158,How does a convolutional layer differ from a fully connected layer?,"A convolutional layer uses a set of filters to scan across the input data and produce feature maps, with each filter detecting specific patterns. In contrast, a fully connected layer connects every neuron in one layer to every neuron in the next, which doesn’t take spatial relationships into account.",3
159,What is a filter (kernel) in a CNN?,"A filter, or kernel, in a CNN is a small matrix used to scan over the input data and detect specific patterns or features. The filter is convolved with the input to produce a feature map that highlights the presence of those patterns.",3
160,What is stride in CNNs?,"Stride refers to the step size with which the filter moves across the input data. A stride of 1 means the filter moves one pixel at a time, while a stride of 2 means it moves two pixels at a time. Larger strides reduce the spatial dimensions of the output feature map.",3
161,Why is padding used in CNNs?,"Padding is used to add extra pixels around the input data, typically to preserve the spatial dimensions of the output feature map after convolution. It also helps in preventing the loss of information at the borders of the input.",3
162,"What are pooling layers, and what types are there?",Pooling layers reduce the spatial dimensions of feature maps by summarizing information in each region. Common types of pooling include Max Pooling (selecting the maximum value) and Average Pooling (computing the average value) within a region.,3
163,What is the purpose of the ReLU activation function in CNNs?,The ReLU (Rectified Linear Unit) activation function introduces non-linearity into the network by setting all negative values in the feature maps to zero. This allows the CNN to learn more complex patterns and improves training efficiency.,3
164,How does a CNN achieve translation invariance?,"CNNs achieve translation invariance through convolutional layers that detect local features irrespective of their location in the input and through pooling layers that reduce spatial dimensions, making the network less sensitive to small translations of the input.",3
165,What is the role of a fully connected layer in a CNN?,A fully connected layer at the end of a CNN takes the high-level features learned by the convolutional layers and combines them to make the final classification or prediction. It connects every neuron in one layer to every neuron in the next.,3
166,Why is dropout used in CNNs?,Dropout is a regularization technique used to prevent overfitting by randomly setting a fraction of the neurons in a layer to zero during training. This forces the network to learn more robust features and reduces reliance on any single neuron.,3
167,"What is data augmentation, and why is it important in CNN training?","Data augmentation involves artificially increasing the size and diversity of the training dataset by applying transformations such as rotations, flips, or shifts to the input data. It helps improve the generalization of the CNN by exposing it to more variations of the data.",3
168,What is the significance of batch normalization in CNNs?,Batch normalization is a technique used to normalize the inputs to each layer within a mini-batch during training. It helps stabilize and accelerate training by reducing internal covariate shifts and allows the use of higher learning rates.,3
169,What is transfer learning in the context of CNNs?,"Transfer learning involves using a pre-trained CNN model on a new but related task. By leveraging the features learned from a large dataset, such as ImageNet, transfer learning allows for faster convergence and better performance on tasks with smaller datasets.",3
170,How does the concept of receptive field relate to CNNs?,"The receptive field refers to the region of the input that influences a particular neuron’s output in the feature map. In CNNs, the receptive field grows as you move deeper into the network, allowing the neurons in higher layers to capture more complex, global features.",3
171,"What is a Residual Block, and how is it used in CNNs?",A Residual Block is a component of ResNet architectures that includes a shortcut connection (identity mapping) that bypasses one or more convolutional layers. This helps in training very deep networks by mitigating the vanishing gradient problem and improving gradient flow.,3
172,"What is a Fully Convolutional Network (FCN), and how does it differ from a traditional CNN?","A Fully Convolutional Network (FCN) is a type of CNN where the final fully connected layers are replaced by convolutional layers, allowing the network to output spatial maps instead of class scores. FCNs are often used for tasks like image segmentation.",3
173,What is the purpose of using Global Average Pooling in CNNs?,Global Average Pooling replaces the fully connected layers in a CNN with an operation that averages the entire spatial dimension of the feature maps into a single value per feature map. This reduces the number of parameters and helps prevent overfitting.,3
174,How can CNNs be applied to non-image data?,"CNNs can be applied to non-image data that has a grid-like structure, such as time-series data (using 1D convolutions) or text data (using embeddings followed by 1D convolutions). They can also be adapted for tasks like audio processing or medical data analysis.",3
175,"What is the vanishing gradient problem, and how does it affect CNNs?","The vanishing gradient problem occurs when the gradients used to update the weights become very small as they are propagated back through the network, particularly in deep networks. This can slow down training or prevent the network from learning effectively. Techniques like ReLU activation and Residual Blocks help mitigate this problem.",3
176,What are some challenges associated with training CNNs?,"Challenges in training CNNs include dealing with large computational costs, preventing overfitting (especially on small datasets), managing large amounts of data, tuning hyperparameters like learning rate and batch size, and handling the vanishing or exploding gradient problem in very deep networks.",3
177,What is a Recurrent Neural Network (RNN)?,"A Recurrent Neural Network (RNN) is a type of neural network designed for sequential data. Unlike traditional neural networks, RNNs have connections that form directed cycles, allowing them to maintain a memory of previous inputs through hidden states, making them suitable for tasks like time-series analysis, language modeling, and speech recognition.",3
178,How does the hidden state in an RNN work?,"The hidden state in an RNN acts as a memory that captures information from previous time steps in the sequence. At each time step, the hidden state is updated based on the current input and the previous hidden state, allowing the RNN to maintain context over time.",3
179,What is the vanishing gradient problem in RNNs?,"The vanishing gradient problem occurs when gradients used for updating the weights become very small during backpropagation, especially in deep RNNs. This can prevent the network from learning effectively over long sequences, as the impact of earlier inputs diminishes. Long Short-Term Memory (LSTM) and Gated Recurrent Units (GRU) are designed to mitigate this issue.",3
180,"What is an LSTM, and how does it address the limitations of standard RNNs?","Long Short-Term Memory (LSTM) is a type of RNN architecture that addresses the vanishing gradient problem by introducing memory cells and gates (input, forget, and output gates) that control the flow of information. This allows LSTMs to capture long-term dependencies in sequences more effectively than standard RNNs.",3
181,What are the applications of RNNs?,"RNNs are used in various applications involving sequential data, including natural language processing (NLP) tasks like language modeling, text generation, and machine translation, as well as time-series forecasting, speech recognition, and video analysis.",3
182,"What is a GRU, and how does it differ from an LSTM?","Gated Recurrent Unit (GRU) is a simpler variant of LSTM that also addresses the vanishing gradient problem. GRUs have two gates (reset and update gates) instead of the three gates in LSTMs, making them computationally more efficient while still capturing long-term dependencies.",3
183,What is sequence-to-sequence (seq2seq) modeling in RNNs?,"Sequence-to-sequence (seq2seq) modeling involves using RNNs to convert an input sequence into an output sequence, often with different lengths. This approach is commonly used in machine translation, where an input sentence in one language is transformed into a sentence in another language.",3
184,How do bidirectional RNNs differ from standard RNNs?,"Bidirectional RNNs process the input sequence in both forward and backward directions using two separate hidden states. This allows the network to capture context from both past and future inputs, improving performance in tasks where context from the entire sequence is important, such as NLP.",3
185,What are the challenges of training RNNs?,"Training RNNs can be challenging due to issues like the vanishing and exploding gradient problems, difficulty in capturing long-term dependencies, and the need for significant computational resources. These challenges are often addressed using architectures like LSTM, GRU, and careful tuning of hyperparameters.",3
186,What is the difference between RNN and CNN?,"RNNs are designed for sequential data and have a mechanism for maintaining context across time steps, making them ideal for tasks involving sequences. In contrast, Convolutional Neural Networks (CNNs) are designed for spatial data, such as images, and use convolutional layers to detect local patterns. RNNs focus on temporal dependencies, while CNNs focus on spatial hierarchies.",3
187,What is an Autoencoder?,An Autoencoder is a type of neural network used for unsupervised learning that aims to learn a compressed representation (encoding) of input data. It consists of an encoder that compresses the input into a latent space representation and a decoder that reconstructs the original input from this compressed representation.,3
188,What are the main components of an Autoencoder?,"The main components of an Autoencoder are the encoder, which compresses the input data into a lower-dimensional latent space, and the decoder, which reconstructs the input data from this latent representation. The goal is to minimize the difference between the original input and the reconstructed output.",3
189,What is the latent space in an Autoencoder?,"The latent space in an Autoencoder is the lower-dimensional representation of the input data, typically at the bottleneck layer of the network. This latent space captures the most important features of the input, allowing the network to reconstruct the data from this compressed form.",3
190,What are the applications of Autoencoders?,"Autoencoders are used in various applications, including dimensionality reduction, anomaly detection, image denoising, data compression, and generating new data (using variational autoencoders). They are also used for feature learning and pretraining other neural networks.",3
191,What is a Variational Autoencoder (VAE)?,"A Variational Autoencoder (VAE) is a type of generative model that extends the standard Autoencoder by introducing a probabilistic approach to the latent space. VAEs learn to encode input data into a distribution over the latent space, allowing them to generate new data samples by sampling from this distribution.",3
192,How does an Autoencoder differ from Principal Component Analysis (PCA)?,"Both Autoencoders and PCA are used for dimensionality reduction, but they differ in approach. PCA is a linear method that finds the principal components of the data, while Autoencoders are non-linear and can capture more complex patterns by using neural networks. Autoencoders can learn more expressive and complex representations than PCA.",3
193,"What is a Sparse Autoencoder?
","A Sparse Autoencoder is a variant of the standard Autoencoder where sparsity is enforced on the latent representation. This means that only a small number of neurons in the bottleneck layer are activated for any given input, encouraging the network to learn more distinct and meaningful features.",3
194,What is a Denoising Autoencoder?,"A Denoising Autoencoder is designed to reconstruct the original input from a corrupted version of the data. By training on noisy inputs and clean outputs, it learns to remove noise and recover the underlying data, making it useful for tasks like image denoising.",3
195,What is the difference between an undercomplete and an overcomplete Autoencoder?,"An undercomplete Autoencoder has a latent space that is smaller than the input space, forcing the network to learn a compressed representation of the data. An overcomplete Autoencoder, on the other hand, has a latent space that is larger than the input space, which can lead to the network simply copying the input to the output without learning meaningful features unless regularization is applied.",3
196,How can Autoencoders be used for anomaly detection?,"Autoencoders can be used for anomaly detection by training them on normal (non-anomalous) data. When an Autoencoder encounters anomalous data, it will struggle to reconstruct it accurately, resulting in a higher reconstruction error. By setting a threshold on the reconstruction error, anomalies can be detected.",3
197,"What is an LSTM, and how does it differ from a standard RNN?","LSTM (Long Short-Term Memory) is a type of RNN architecture designed to overcome the vanishing gradient problem in standard RNNs. LSTM units include memory cells and gating mechanisms (input, forget, and output gates) that control the flow of information, allowing the network to capture long-term dependencies more effectively.",3
198,What are the main components of an LSTM cell?,"The main components of an LSTM cell include the memory cell (which maintains the long-term state), the input gate (controls what information enters the memory), the forget gate (controls what information is discarded), and the output gate (controls what information is passed to the next hidden state).",3
199,"How does the forget gate in an LSTM work, and why is it important?","The forget gate in an LSTM determines which information from the memory cell should be discarded at each time step. It is crucial for preventing the accumulation of irrelevant information in the memory, enabling the network to focus on important data as it processes sequences.",3
200,Why are LSTMs well-suited for tasks involving long sequences?,"LSTMs are well-suited for long sequences because their architecture, including the memory cell and gating mechanisms, allows them to maintain and update information over extended time steps. This capability helps LSTMs capture long-term dependencies that standard RNNs struggle with.",3
201,What are some common applications of LSTMs?,"Common applications of LSTMs include natural language processing (e.g., language modeling, machine translation), speech recognition, time-series forecasting, and video analysis. LSTMs are used in any task that requires modeling sequential data with long-term dependencies.",3
