,Q,A,Unit
1,What is a linear classifier?,A linear classifier is a model that makes predictions based on a linear combination of input features. It decides the class by checking on which side of a decision boundary (a hyperplane) a data point lies.,1
2,How does a linear classifier make predictions?,A linear classifier predicts by calculating the dot product of input features with weights and adding a bias term. The sign of the output determines the class.,1
3,What is the objective function in a linear classifier?,"The objective function often used is the loss function, such as hinge loss in SVMs or cross-entropy in logistic regression, which measures the error between predicted and actual labels.",1
4,What is gradient descent?,Gradient descent is an optimization algorithm that iteratively updates model parameters to minimize a loss function. It moves in the direction of the negative gradient of the loss function.,1
5,How does learning rate affect gradient descent?,"The learning rate controls the step size in gradient descent. A small learning rate leads to slow convergence, while a large learning rate may overshoot the minimum, causing instability.",1
6,What is the role of the bias term in a linear classifier?,"The bias term allows the decision boundary to shift away from the origin, enabling the model to better fit the data, especially when the data is not centered around the origin.",1
7,What is the difference between batch gradient descent and stochastic gradient descent (SGD)?,"Batch gradient descent updates weights after computing the gradient over the entire dataset, while SGD updates weights after each individual training example, making it faster but noisier.",1
8,What is the significance of the decision boundary in a linear classifier?,The decision boundary separates the input space into regions corresponding to different class labels. It’s defined by the weights and bias in the model.,1
9,Why might gradient descent converge to a local minimum instead of a global minimum?,"Gradient descent may converge to a local minimum in non-convex functions, where multiple minima exist. However, for convex functions like those in linear classifiers, it converges to a global minimum.",1
10,How can overfitting be reduced in linear classifiers?,"Overfitting can be reduced using regularization techniques (like L1 or L2), which penalize large weights, or by using techniques like cross-validation, early stopping, or adding more training data.",1
11,What is the purpose of a loss function in machine learning?,"The loss function measures the difference between the predicted values and the actual values. It quantifies how well the model is performing, guiding the optimization process to minimize errors.",1
12,What is the difference between mean squared error (MSE) and cross-entropy loss?,MSE is used in regression tasks and measures the average squared difference between predicted and actual values. Cross-entropy loss is used in classification tasks and measures the difference between predicted probabilities and the actual class labels.,1
13,How does regularization affect the loss function?,"Regularization adds a penalty term to the loss function to discourage large model weights, preventing overfitting. Common regularization techniques include L1 (lasso) and L2 (ridge) regularization, which penalize the absolute sum and the square of weights, respectively.",1
14,What is K-Nearest Neighbors (KNN)?,"K-Nearest Neighbors (KNN) is a simple, non-parametric algorithm used for classification and regression. It classifies a data point based on how its neighbors are classified.",1
15,How does KNN determine the class of a new data point?,KNN assigns a class to a new data point based on the majority class among its k-nearest neighbors in the feature space.,1
16,How is distance measured in KNN?,"Distance in KNN is typically measured using Euclidean distance, but other metrics like Manhattan or Minkowski distance can also be used depending on the problem.",1
17,How does KNN handle multi-class classification?,"KNN handles multi-class classification by assigning the class that is most common among the k-nearest neighbors, irrespective of the number of classes.",1
18,"How does KNN perform feature scaling, and why is it important?","Feature scaling is important in KNN because it relies on distance metrics. Without scaling, features with larger ranges can dominate the distance calculation, skewing the results.",1
19,What are some methods to improve KNN efficiency?,"Efficiency in KNN can be improved by using techniques like KD-Trees, Ball Trees, or approximate nearest neighbors to reduce the number of distance calculations.",1
20,What is linear regression?,Linear regression is a statistical method used to model the relationship between a dependent variable and one or more independent variables by fitting a linear equation to observed data.,1
21,What is the equation of a simple linear regression model?,"The equation of a simple linear regression model is y = mx + b, where y is the dependent variable, x is the independent variable, m is the slope, and b is the intercept.",1
22,How is the goodness of fit measured in linear regression?,"The goodness of fit in linear regression is commonly measured using the R-squared value, which indicates the proportion of variance in the dependent variable explained by the independent variables.",1
23,What is the purpose of the intercept term in linear regression?,The intercept term in linear regression represents the expected value of the dependent variable when all independent variables are zero. It shifts the regression line up or down.,1
24,What assumptions are made in linear regression?,"Linear regression assumes linearity, independence of errors, homoscedasticity (constant variance of errors), and normality of residuals.",1
25,What is logistic regression?,Logistic regression is a statistical method used for binary classification problems. It models the probability that a given input belongs to a particular class using a logistic function.,1
26,What is the equation of a logistic regression model?,"The logistic regression model is represented by log(odds) = b0 + b1x1 + ... + bnxn, where odds = p/(1-p) and p is the probability of the positive class.",1
27,What is the role of the sigmoid function in logistic regression?,The sigmoid function in logistic regression maps the output of the linear combination of inputs to a probability value between 0 and 1.,1
28,How is the loss function defined in logistic regression?,"The loss function in logistic regression is the cross-entropy loss (or log-loss), which measures the difference between predicted probabilities and actual binary labels.",1
29,What is the difference between linear regression and logistic regression?,"Linear regression is used for predicting continuous outcomes, while logistic regression is used for binary classification. Linear regression uses a linear function, while logistic regression uses a logistic function.",1
30,What is a decision tree?,"A decision tree is a supervised learning algorithm used for classification and regression. It splits the data into subsets based on the most significant attribute, creating a tree-like model of decisions.",1
31,How does a decision tree determine the best split?,"A decision tree determines the best split by evaluating criteria like Gini impurity, information gain, or mean squared error, depending on the problem type (classification or regression).",1
32,"What is overfitting in decision trees, and how can it be prevented?","Overfitting occurs when a decision tree becomes too complex, capturing noise in the data. It can be prevented by pruning the tree, setting a maximum depth, or requiring a minimum number of samples per leaf.",1
33,What are the advantages of using decision trees?,"Advantages of decision trees include their interpretability, ability to handle both numerical and categorical data, and no need for feature scaling or normalization.",1
34,What is pruning in the context of decision trees?,"Pruning is the process of removing branches from a decision tree that provide little predictive power, reducing complexity and helping to prevent overfitting.",1
35,What is a Support Vector Machine (SVM)?,SVM is a supervised learning algorithm used for classification and regression. It finds the hyperplane that best separates the data into different classes with the maximum margin.,1
36,What is a hyperplane in the context of SVM?,A hyperplane is a decision boundary that separates different classes in the feature space. SVM aims to find the hyperplane with the maximum margin between classes.,1
37,"What is the margin in SVM, and why is it important?",The margin is the distance between the hyperplane and the nearest data points (support vectors) from either class. A larger margin generally leads to better generalization.,1
38,What are support vectors in SVM?,Support vectors are the data points closest to the hyperplane. They are critical in defining the position and orientation of the hyperplane.,1
39,What is the kernel trick in SVM?,"The kernel trick allows SVM to operate in a high-dimensional space by transforming the input data into a higher dimension, making it possible to find a linear separator for non-linear data.",1
40,What are some common types of kernels used in SVM?,"Common kernels include the linear kernel, polynomial kernel, radial basis function (RBF) kernel, and sigmoid kernel. The choice of kernel depends on the nature of the data.",1
41,What is the role of the regularization parameter (C) in SVM?,The regularization parameter (C) controls the trade-off between maximizing the margin and minimizing classification error. A smaller C creates a wider margin but allows more misclassifications.,1
42,What is the difference between a hard margin and a soft margin in SVM?,A hard margin SVM does not allow any misclassification and requires a perfectly separable dataset. A soft margin SVM allows some misclassification to improve generalization.,1
43,What is ensemble learning?,Ensemble learning is a technique that combines multiple models (learners) to improve overall performance. It leverages the strengths of individual models to create a more robust predictor.,1
44,What are the common types of ensemble methods?,"Common ensemble methods include Bagging (e.g., Random Forest), Boosting (e.g., AdaBoost, Gradient Boosting), and Stacking, each with different approaches to combining models.",1
45,What is Bagging in ensemble methods?,"Bagging, or Bootstrap Aggregating, involves training multiple models on different random subsets of the data and averaging their predictions to reduce variance and avoid overfitting.",1
46,What is Boosting in ensemble methods?,"Boosting is an iterative technique where models are trained sequentially, with each new model focusing on correcting errors made by previous models, thereby reducing bias and variance.",1
47,"What is Random Forest, and how does it work?",Random Forest is an ensemble method that uses multiple decision trees trained on different data subsets. It combines their predictions by averaging (for regression) or majority voting (for classification).,1
48,What is the role of feature importance in Random Forest?,"Feature importance in Random Forest quantifies the contribution of each feature to the model's decision-making process, helping in feature selection and understanding the model.",1
49,What is the difference between Bagging and Boosting?,"Bagging reduces variance by averaging multiple independent models, while Boosting reduces bias by sequentially improving weak learners. Bagging is parallel; Boosting is sequential.",1
50,What is NumPy and what is it used for?,"NumPy is a fundamental Python library for numerical computing. It provides support for arrays, matrices, and a collection of mathematical functions to operate on these data structures.",1
51,How do you create a NumPy array?,"A NumPy array can be created using the np.array() function by passing a list or list of lists, e.g., np.array([1, 2, 3]).",1
52,What is pandas and what are its main data structures?,"Pandas is a Python library used for data manipulation and analysis. Its main data structures are Series (1D) and DataFrame (2D), which allow for easy handling of labeled data.",1
53,How do you select a column from a pandas DataFrame?,"A column from a pandas DataFrame can be selected using either df['column_name'] or df.column_name, where df is the DataFrame.",1
54,What is scikit-learn (sklearn) used for?,"Scikit-learn (sklearn) is a Python library used for machine learning. It provides tools for classification, regression, clustering, dimensionality reduction, and model selection.",1
55,How do you split data into training and testing sets using scikit-learn?,"Data can be split using sklearn's train_test_split() function, e.g., X_train, X_test, y_train, y_test = train_test_split(X, y, test_size=0.2).",1
56,What is SciPy and how does it relate to NumPy?,"SciPy is a Python library built on top of NumPy, providing additional functionality for scientific computing, including optimization, integration, interpolation, and statistical functions.",1
57,How do you compute the mean of a NumPy array?,"The mean of a NumPy array can be computed using np.mean(array), where array is the NumPy array.",1
58,How do you handle missing data in a pandas DataFrame?,Missing data in a pandas DataFrame can be handled using methods like df.dropna() to remove missing values or df.fillna(value) to fill them with a specified value.,1
59,What is the role of the fit() method in scikit-learn?,The fit() method in scikit-learn is used to train a model on the provided dataset by learning the relationship between input features and the target variable.,1
60,What is the Bag of Words (BoW) model?,"The Bag of Words model is a method to extract features from text documents by considering the words and their frequency of occurrence, disregarding the semantic relationship between words.",2
61,How does the BoW model create a vocabulary?,The BoW model creates a vocabulary by listing all the unique words occurring in all the documents in the training set.,2
62,What is the main purpose of using the BoW model?,The main purpose of using the BoW model is to generate features for training machine learning algorithms.,2
63,Give an example of how the BoW model works with three documents,"For documents D1: “I am feeling very happy today”, D2: “I am not well today”, and D3: “I wish I could go to play”, the BoW model creates a vocabulary and counts the frequency of each word in each document.",2
64,What are the two major issues with the BoW model?,"The two major issues are the dimensionality problem, as the total dimension is the vocabulary size, and the lack of consideration for the semantic relationship between words.",2
65,How can the dimensionality issue in the BoW model be addressed?,The dimensionality issue can be addressed by applying well-known dimensionality reduction techniques to the input data.,2
66,Why is the sequence or order of words not important in the BoW model?,"In the BoW model, the number of occurrences of words is what matters, not the sequence or order of words.",2
67,What does the BoW model disregard in its approach?,The BoW model disregards the semantic relationship between words in the sentences.,2
68,How does the BoW model represent the frequency of words in documents?,The BoW model represents the frequency of words in documents using a table where each row corresponds to a document and each column corresponds to a word from the vocabulary.,2
69,What is the significance of neighbor words in a sentence according to the BoW model?,"The BoW model does not consider the significance of neighbor words in a sentence, which is generally useful for predicting the target word.",2
70,What is Natural Language Processing (NLP)?,"NLP is a field of computer science, artificial intelligence, and computational linguistics concerned with the interactions between computers and human (natural) languages.",2
71,What are the two generations of NLP?,"The two generations are Hand-crafted Systems (Knowledge Engineering) and Automatic, Trainable (Machine Learning) Systems.",2
72,What are some common NLP tasks?,"Common NLP tasks include tokenization, part of speech tagging, parsing, semantic tagging, named entity recognition, and coreference resolution.",2
73,What is the significance of language modeling in NLP?,"Language modeling examines short sequences of words to predict the likelihood of each sequence, which is crucial for understanding and generating natural language.",2
74,What is the Markov Assumption in language modeling?,The Markov Assumption states that a word is affected only by its prior local context (the last few words).,2
75,What are n-grams in the context of NLP?,N-grams are sequences of ‘n’ words used to predict the probability of word sequences in language modeling.,2
76,What is the purpose of smoothing in language modeling?,"Smoothing techniques, like Laplace smoothing, are used to handle unseen n-grams and improve the accuracy of language models.",2
77,What is the Zipf Distribution in NLP?,"The Zipf Distribution describes how a few elements occur very frequently, a medium number of elements have medium frequency, and many elements occur very infrequently.",2
78,What is Part of Speech (POS) tagging?,"POS tagging assigns a part of speech to each word in a given sentence, helping in understanding the grammatical structure of the sentence.",2
79,What is named entity recognition (NER)?,"NER identifies and classifies strings of characters representing proper nouns, such as names of people, organizations, and locations.",2
80,What is Word2Vec?,"Word2Vec is a machine learning model used to generate word embeddings, where words with similar meanings are positioned close to each other in vector space.",2
81,Who developed Word2Vec?,Word2Vec was developed by a team led by Mikolov et al. at Google.,2
82,What is the primary purpose of Word2Vec?,The primary purpose of Word2Vec is to capture the relationships between words and cluster similar words together in vector space.,2
83,How does Word2Vec handle the relationship between words like ‘king’ and ‘queen’?,"Word2Vec can perform relational operations such as “King - Man + Woman = Queen,” demonstrating its ability to capture semantic relationships.",2
84,What are word embeddings?,Word embeddings are vector representations of words that capture their meanings and relationships with other words.,2
85,How does Word2Vec create word embeddings?,Word2Vec creates word embeddings by training on a large corpus of text and positioning similar words close to each other in vector space.,2
86,What is an example of words clustered together by Word2Vec?,"Words like “Paris,” “Beijing,” “Tokyo,” “Delhi,” and “New York” are clustered together, as are “cat,” “dog,” “rat,” and “duck.”",2
87,What kind of operations can Word2Vec perform?,"Word2Vec can extract the most similar words, measure the similarity between two words, and identify the odd word out in a group.",2
88,What is the significance of vector space in Word2Vec?,"Vector space allows Word2Vec to position words in such a way that their semantic relationships are preserved, enabling meaningful operations on the words.",2
89,What is a practical application of Word2Vec?,"A practical application of Word2Vec is in natural language processing tasks where understanding the relationships between words is crucial, such as in search engines and recommendation systems.",2
90,What is the assumption behind dimensionality reduction?,"High-dimensional data often lives in a lower-dimensional manifold (sub-space), and we can represent the data points well by using just their lower-dimensional coordinates.",2
91,What is Principal Component Analysis (PCA) used for?,PCA is used to reduce the dimensionality of data by capturing the distribution of points in high dimensions using their lower-dimensional coordinates.,2
92,What is the difference between global and local approaches in dimensionality reduction?,"The global approach considers all distances in high dimensions equally important, while the local approach focuses on smaller, meaningful distances.",2
93,What is Multidimensional Scaling (MDS)?,MDS is a technique that finds a representation that best preserves pair-wise distances between samples in high and low dimensions.,2
94,What is a fundamental shortcoming of PCA?,"PCA assumes linearity, which may not be suitable for non-linear datasets like the Swiss-Roll dataset.",2
95,What is ISOMAP and how does it work?,ISOMAP is a method that measures distances along the manifold by connecting each data point to its k nearest neighbors in high-dimensional space and computing the low-dimensional embedding.,2
96,What are the issues with ISOMAP?,"ISOMAP can suffer from “short-circuit errors” if k is too large or too small, affecting the accuracy of the geodesic distance matrix and the low-dimensional embedding.",2
97,What is Locally Linear Embedding (LLE)?,LLE preserves the structure of local neighborhoods by representing each point as a weighted combination of its neighbors in high dimensions and finding a low-dimensional representation that minimizes the representation error.,2
98,What is the idea behind SNE and t-SNE?,"SNE and t-SNE use probabilities instead of distances to represent the likelihood of points being neighbors, optimizing these probabilities to be similar in low dimensions.",2
99,How does t-SNE differ from SNE?,"t-SNE uses a t-distribution with 1 degree of freedom instead of a Gaussian distribution, which helps in better capturing the local structure in the data.",2
100,What is a Multi-Layer Perceptron (MLP)?,"An MLP is a type of neural network that consists of at least three layers: an input layer, one or more hidden layers, and an output layer.",2
101,What is the role of activation functions in MLP?,"Activation functions, such as step or sigmoid functions, are used in the neurons of hidden and output layers to introduce non-linearity into the model.",2
102,What is the primary algorithm used for training MLPs?,The primary algorithm used for training MLPs is backpropagation.,2
103,What is the objective of the backpropagation algorithm?,The objective of backpropagation is to update the weights of the network to minimize the error between the predicted and actual outputs.,2
104,How is the error or loss calculated in MLP?,The error or loss is calculated as the squared difference between the actual class and the predicted class.,2
105,What happens when the actual class deviates from the predicted class in MLP?,"When the actual class deviates from the predicted class, the squared error or loss is computed, and the weights are updated to reduce this error.",2
106,What is the significance of the ground truth (GT) in MLP training?,"The ground truth (GT) represents the actual class, and it is used to calculate the loss and guide the weight updates during training.",2
107,How does the backpropagation algorithm update weights?,"The backpropagation algorithm updates weights using gradient descent, which involves computing the gradient of the loss function with respect to the weights and adjusting the weights in the opposite direction of the gradient.",2
108,What is the result of successful training in MLP?,"Successful training in MLP results in reduced loss or error, and the network finds appropriate weights that minimize the difference between predicted and actual outputs.",2
109,What is the role of hidden layers in MLP?,Hidden layers in MLP help capture complex patterns and relationships in the data by introducing additional layers of computation between the input and output layers.,2
110,`What are the key steps in the model development process?,"The key steps include acquiring raw data, preparing and cleaning data, feature engineering, picking a model and hyper-parameters, model training and optimization, evaluating model performance, and deploying the model.",2
111,`What is accuracy in the context of model performance evaluation?,Accuracy is the ratio of correctly predicted observations to the total observations.,2
112,`How is precision calculated?,Precision is calculated as the ratio of true positives (TP) to the sum of true positives and false positives (TP + FP).,2
113,`What does recall measure in model evaluation?,Recall measures the ratio of true positives (TP) to the sum of true positives and false negatives (TP + FN).,2
114,`What is the F1 Score and why is it important?,"The F1 Score is the harmonic mean of precision and recall, providing a balance between the two metrics, especially useful when dealing with imbalanced datasets.",2
115,`What are ROC and PR curves used for?,ROC (Receiver Operating Characteristic) and PR (Precision-Recall) curves are used to evaluate the performance of classification models by illustrating the trade-offs between different metrics.,2
116,`What is the significance of the confusion matrix in model evaluation?,"The confusion matrix helps in understanding the performance of a classification model by showing the counts of true positives, true negatives, false positives, and false negatives.",2
117,`How is the True Positive Rate (TPR) calculated?,"TPR, also known as recall, is calculated as the ratio of true positives (TP) to the sum of true positives and false negatives (TP + FN).",2
118,`What is the False Positive Rate (FPR)?,FPR is the ratio of false positives (FP) to the sum of false positives and true negatives (FP + TN).,2
