,Q,A,Unit
277,What is self-supervised learning (SSL)?,"Self-Supervised Learning (SSL) is a type of representation learning where a model is trained on unlabelled data by creating supervised learning tasks. This approach helps in learning good data representations that can be transferred to various downstream tasks, especially when labeled data is scarce.",4
278,Why is self-supervised learning important?,"SSL is important because it addresses the issue of the scarcity of labeled data, which is expensive to obtain. By leveraging large amounts of unlabeled data, SSL can learn useful representations that can improve performance on tasks with limited labeled examples and enable zero-shot transfer to new tasks.",4
279,What are the two popular methods for framing self-supervised learning tasks?,The two popular methods are: 1) Self-prediction: Predicting a part of a data sample using another part of the same sample. 2) Contrastive learning: Predicting the relationship among multiple data samples.,4
280,What is contrastive learning?,"Contrastive learning is a method in SSL where the model learns to distinguish between similar (positive) and dissimilar (negative) data samples. The goal is to create an embedding space where similar samples are close to each other, while dissimilar samples are far apart.",4
281,What is a pretext task in the context of self-supervised learning?,"A pretext task is an artificially created task that does not require manual labeling but is designed to train a model to learn useful features. Examples include predicting the rotation of an image, solving jigsaw puzzles, or filling in missing pixels in an image.",4
282,Can you give an example of a pretext task used in NLP?,"In NLP, a common pretext task is predicting the center word given a window of surrounding words, as seen in models like Word2Vec. Another example is predicting masked words in a sentence, which is used in models like BERT.",4
283,How does contrastive loss function in self-supervised learning?,"The contrastive loss function works by encoding data into embedding vectors, ensuring that samples from the same class (positives) have similar embeddings, while samples from different classes (negatives) have different embeddings. This helps the model to learn meaningful representations.",4
284,"What is the purpose of the ""jigsaw puzzle"" pretext task?","The ""jigsaw puzzle"" pretext task involves shuffling patches of an image and having the model predict the correct arrangement. This task helps the model learn spatial relationships and visual structures within an image.",4
285,"What is the significance of the statement ""Self-supervised learning is supervised learning without specific task annotations""?","This statement highlights that SSL creates supervised tasks from unlabeled data, effectively simulating the conditions of supervised learning but without the need for labeled data. This allows models to learn from vast amounts of unlabeled data, which is more readily available.",4
286,How is self-supervised learning applied in vision and NLP?,"In vision, SSL is applied through tasks like predicting rotations, solving jigsaw puzzles, and inpainting. In NLP, it is applied through tasks like predicting masked words, sentence ordering, and context prediction. These tasks help in learning representations that can be used in downstream applications like image classification and language understanding.",4
287,What is the primary goal of computer vision?,"The primary goal of computer vision is to extract all possible information about a visual scene through computer processing, including answering questions like What? When? Where? Who? How? Why? and How many?",4
288,Why is computer vision considered difficult?,"Computer vision is considered difficult because it involves understanding and interpreting visual data, which includes handling large intra-class variations, recognizing objects despite changes in appearance, and replicating the sophisticated but not fully understood mechanisms of human vision.",4
289,"What are the three ""R's"" of computer vision mentioned in the document?","The three ""R's"" of computer vision are Reorganization (segmentation), Recognition (connecting visual input to memory), and Reconstruction (measuring and recreating 3D models of what we see).",4
290,What is the role of segmentation in computer vision?,"Segmentation in computer vision involves grouping similar parts of an image into meaningful regions, which is crucial for recognizing and reconstructing objects within a visual scene.",4
291,How does the pinhole camera model relate to computer vision?,"The pinhole camera model is a mathematical representation used in computer vision to understand how a camera projects a 3D scene onto a 2D image, which helps in tasks like recovering world geometry and calibrating cameras.",4
292,What are some of the applications of planar homography in computer vision?,"Planar homography in computer vision is used for applications like removing perspective distortion, rendering planar textures, rendering planar shadows, and estimating camera pose for augmented reality.",4
293,Why is the concept of stereo geometry important in computer vision?,"Stereo geometry is important in computer vision because it allows for depth perception by identifying common points in two camera views, which is essential for tasks like 3D reconstruction and autonomous navigation.",4
294,What is the significance of the Viola/Jones face detector in computer vision?,"The Viola/Jones face detector is significant because it introduced a real-time object detection approach using Haar features and an attentional cascade, which was a breakthrough in fast and efficient face detection.",4
295,What are some modern approaches to object detection mentioned in the document?,"Some modern approaches to object detection mentioned include YOLO (You Only Look Once), SSD (Single Shot MultiBox Detector), and RetinaNet, which balance speed and accuracy in detecting objects.",4
296,What are some key challenges in image segmentation in computer vision?,"Key challenges in image segmentation include the need to balance classification and localization, as segmentation requires both a broad context for accurate classification and sensitivity to location for precise boundary detection.",4
297,What is transfer learning?,"Transfer learning involves taking the knowledge gained from a pre-trained model on one task and applying it to a different, but related task. This approach allows for leveraging pre-existing patterns learned by the model, making it easier and faster to train on new tasks with less data.",4
298,Why is transfer learning beneficial?,"Transfer learning is beneficial because it addresses the challenges of limited data availability, long training times for deep learning models, and the need for extensive computational resources. By using a pre-trained model, it is possible to achieve good performance even on small datasets with less computational cost.",4
299,What are the two main components of a Convolutional Neural Network (CNN) in the context of transfer learning?,"The two main components of a CNN in transfer learning are the convolutional base, which is responsible for feature extraction, and the densely connected classifier, which is typically retrained or fine-tuned for the specific task at hand.",4
300,What are the steps involved in using a pre-trained model for transfer learning?,"The steps involved in using a pre-trained model include:	
1	Start with a pre-trained network.
2	Partition the network into featurizers and classifiers.
3	Re-train the classifier layers with new data.
4	Unfreeze the weights of the later layers and fine-tune the network as needed.",4
301,How do you decide which layers to re-train during transfer learning?,"The decision on which layers to re-train depends on the domain and dataset similarity. If the new task is very different from the original task, you might retrain more layers starting from the last fully connected and convolutional layers. If the tasks are similar, only the last layers may need retraining.",4
302,What are some popular pre-trained models mentioned in the document?,"Some popular pre-trained models mentioned are AlexNet (2012), VGGNet (2014), Inception (2014), and ResNet-152 (2015). These models have been trained on large datasets and are widely used for transfer learning in various applications.",4
303,What is the main idea behind feature extraction in transfer learning?,"The main idea behind feature extraction is to reuse the features learned by the convolutional base of a pre-trained model for a new task. Only the classifier is retrained or fine-tuned, which makes the training process faster and less data-intensive.",4
304,How does the concept of dataset size and similarity affect the transfer learning strategy?,"The transfer learning strategy varies with dataset size and similarity:	
	Large and similar dataset: Retain the architecture and initial weights, only customize the last layer for the number of classes.
	Large and different dataset: Train the model from scratch.
	Small and similar dataset: Dont fine-tune to avoid overfitting.
	Small and different dataset: Customize earlier layers and train the classifier.",4
305,"What is data augmentation, and why is it used in transfer learning?","Data augmentation is a technique used to artificially increase the size of the training dataset by applying various transformations such as flipping, rotating, or zooming in/out on the images. It is used to improve model performance and reduce overfitting, especially when dealing with small datasets.",4
306,What are some challenges in using transfer learning with small datasets?,"Challenges include the risk of overfitting due to the limited amount of data, and high variance in model performance estimation. Data augmentation and careful fine-tuning are strategies used to mitigate these challenges.",4
307,What is the primary difference between recognition and verification in the context of Siamese networks?,"Recognition involves identifying which of the K classes a sample belongs to, while verification is about determining if a given sample belongs to a specific class, often by comparing it with known samples (e.g., biometric verification).",4
308,How does a Siamese network typically handle training and verification?,"During verification, Siamese networks often use nearest neighbors to find distances to the samples from the class under question and apply a subject-specific variable threshold. For training, the network uses a small number of samples, often employing one-shot learning to find a feature space suitable for the local geometry.",4
309,What is the objective of the contrastive loss function in Siamese networks? ,"The contrastive loss function aims to minimize the distance between similar pairs and maximize the distance between dissimilar pairs. It is defined as 1?Y12DW2+Y12max?(0,m?DW2)1 - Y \frac{1}{2} D_W^2 + Y \frac{1}{2} \max(0, m - D_W^2)1?Y21 DW2 +Y21 max(0,m?DW2 ), where YYY is 0 for similar and 1 for dissimilar pairs.",4
310,"What is a triplet loss function, and what does it aim to achieve? ",The triplet loss function is used to ensure that the distance between an anchor and a positive sample (same class) is less than the distance between the anchor and a negative sample (different class) by at least a margin. It helps in expanding inter-class distance while shrinking intra-class distance.,4
311,What are the three different scenarios in the context of a triplet loss function? ,"The three scenarios are:
Easy: The distance to the positive sample is naturally less than to the negative sample.
Hard: The distance to the positive sample is greater than to the negative sample.
Semi-hard: The distance to the positive sample is less than to the negative sample, but the difference is less than the margin.",4
312,What is the main challenge of using traditional triplet loss in deep learning?," Traditional triplet loss can suffer from slow convergence and instability, especially with a huge amount of training data, making it difficult to achieve optimal performance quickly.",4
313,What are the two main components of the Center Loss function?,"The Center Loss function comprises two terms: one for inter-class separability (softmax) and another for intra-class compactness, with a balancing factor ?\lambda? that adjusts the influence of each term.",4
314,"What is the Orthogonality Loss, and why was it proposed?", Orthogonality Loss was proposed to enhance the recognition ability of deep face features by punishing the mean value and second moment of the weight matrix of generated feature vectors. It addresses the limitation of traditional softmax loss in distinguishing between classes in high-dimensional feature spaces.,4
315,How does the Siamese network apply in the context of person identification?," In person identification, Siamese networks are used to match across different views, often focusing on face recognition tasks. They are trained to reduce the distance between embeddings of the same person while increasing the distance between embeddings of different people.",4
316,What is a practical application of Siamese networks in natural language processing (NLP)?,"Siamese networks are used in NLP for tasks like sentence completion, response matching, and paraphrase identification, where they compare the embeddings of sentences to determine similarity or match.",4
317,What is the purpose of pruning in neural networks? ,"Pruning aims to compress neural networks by removing redundant parameters, which have negligible value and can be ignored without affecting the model's performance. This reduces the model's size and computational complexity.",4
318,What are the types of pruning mentioned in the document?,"The document discusses four types of pruning: Fine Pruning (pruning individual weights), Coarse Pruning (pruning neurons and layers), Static Pruning (pruning after training), and Dynamic Pruning (pruning during training).",4
319,How does weight pruning benefit model performance?,"Weight pruning makes matrices sparse, which can be stored more efficiently and allows for faster sparse matrix multiplications. This reduces the model's size and computation requirements, making it more efficient during inference.",4
320,What is the role of L1 regularization in ensuring sparsity during training?,"L1 regularization encourages sparsity by adding a penalty proportional to the absolute value of the weights to the loss function. This drives many weights to zero, making the model more efficient without significantly impacting performance.",4
321,"What is binary quantization, and what are its trade-offs?","Binary quantization reduces model size by 32 times and significantly speeds up matrix multiplications. However, it comes with a trade-off in accuracy, leading to about a 20% drop in top-5 classification accuracy on the ILSVRC dataset.",4
322,What is the process of non-uniform quantization or weight sharing?,"Non-uniform quantization involves performing k-means clustering on weights, allowing weights to be shared among clusters. This method significantly reduces storage requirements by encoding weights with fewer bits.",4
323,How does neuron pruning differ from weight pruning?,"Neuron pruning involves removing entire rows and columns in a weight matrix, which directly reduces the number of neurons in the network. This results in faster matrix multiplications and improved test-time performance.",4
324,What is the concept behind student-teacher networks in model compression?,"Student-teacher networks involve training a smaller, shallower network (the student) using the output of a larger, more complex network (the teacher) as the target. This approach helps the student network learn more effectively and efficiently.",4
325,What is the effect of using a regularizer during neuron pruning?,"Regularizers during neuron pruning force the input and output connections of neurons to be small, leading to the removal of weak connections. Neurons with no significant connections are discarded, simplifying the network's structure.",4
326,What are the benefits of model compression techniques like pruning and quantization?,"Model compression techniques reduce the size and computational complexity of neural networks, making them more suitable for deployment on resource-constrained devices like mobile phones. These techniques also improve energy efficiency and reduce latency during inference.",4
327,What is the primary difference between supervised and unsupervised learning?,"Supervised learning involves data with labels, where the goal is to learn a function that maps inputs to outputs (e.g., classification, regression). Unsupervised learning involves data without labels, aiming to learn the underlying hidden structure of the data (e.g., clustering, dimensionality reduction).",4
328,What is the goal of generative modeling?,The goal of generative modeling is to generate new samples that come from the same distribution as the training data.,4
329,What is the typical architecture of a Generative Adversarial Network (GAN)?,"A GAN consists of two neural networks: the generator (G), which tries to produce data that is indistinguishable from real data, and the discriminator (D), which tries to differentiate between real and generated data. The two networks are trained simultaneously in a game-theoretic framework.",4
330,How can autoencoders be used in supervised learning tasks?,"After training, the decoder of an autoencoder can be discarded, and the compressed code generated by the encoder can be used for supervised learning tasks, particularly when dealing with small training datasets.",4
331,What is the main function of the discriminator in a GAN?,The discriminator's main function is to distinguish between real samples from the data distribution and fake samples generated by the generator.,4
332,What is one of the major limitations of GANs?,"One major limitation of GANs is the difficulty in evaluating the quality of generated outputs, as well as the potential ethical concerns related to generating realistic fake data.",4
333,What are some examples of applications for GANs mentioned in the document?,"GANs are used for applications like image-to-image translation, synthetic data generation, and style-based generation, where separate high-level and fine-level attributes (e.g., pose, identity, freckles, hair texture) can be controlled.",4
334,What is a Conditional GAN?,A Conditional GAN is a type of GAN where both the generator and the discriminator have access to additional information (such as class labels or data from another modality) to guide the generation process.,4
335,How does the Progressive GAN improve upon traditional GANs?,"The Progressive GAN improves upon traditional GANs by progressively increasing the resolution of generated images during training, leading to more stable training and higher quality images.",4
336,What is one emerging concern with generative models like GANs?,"An emerging concern with generative models is the potential for them to be used to create realistic but fake data, raising ethical concerns about the misuse of such technology.",4
337,What is the first step in the Machine Learning process as described in the document?,The first step is to convert a real-world problem into a prediction task.,4
338,What are some examples of features that might be used in a binary classifier for job selection?,"Examples of features include years of job experience, previous companies, and keywords in the resume.",4
339,What are some types of models mentioned for training in the ML process?,"The models mentioned include Decision Trees, SVM (Support Vector Machines), Random Forest, Neural Networks, and Logistic Regression.",4
340,What are the different types of metrics mentioned for evaluating a machine learning model?,"The metrics include Precision, Recall, AUC (Area Under the Curve), Accuracy, and F1 Score.",4
341,What does the Big Data Analytics process start with?,"It starts with understanding the business problem, the current solution, and the Return on Investment (ROI).",4
342,What should you consider when engineering features for a model?,"You should consider transforming data, using PCA (Principal Component Analysis), creating smaller categories for categorical data, deriving additional attributes, and experimenting with hyperparameters.",4
343,What is important when designing a validation strategy for a model?,"It is important to divide the data into training, test, and cross-validation (CV) sets and plot error metrics for all models on all data to pick the best one.",4
344,What qualities should you consider when evaluating a classifier?,"Consider classification philosophy, train time, test time, accuracy, interpretability, classification decision boundary, and RAM usage at test time.",4
345,What is a key aspect of analyzing data in the Big Data Analytics process?,A key aspect is to define the target for supervised learning and derive relevant attributes through brainstorming hierarchically.,4
346,What is a critical consideration mentioned when building a machine learning model?,A critical consideration is to build the most efficient and accurate model possible by regularizing and experimenting with various hyperparameters.,4
347,What is the primary context in which the attention mechanism is explained in the document?,The attention mechanism is explained in the context of language translation using the seq2seq (encoder-decoder) architecture.,4
348,What is the function of the encoder in the seq2seq model?,"The encoder ingests the input sequence and computes a final hidden state vector, h(T), which serves as a compressed representation of the entire input sequence.",4
349,What problem does the document highlight with the basic seq2seq model when dealing with long input sequences?,"The problem is that the final encoder state h(T) has a fixed size and must represent the entire input sequence, which can be challenging for very long sentences.",4
350,How does the decoder in the seq2seq model begin generating an output sequence?,The decoder begins with a special '<SOS>' token indicating the start of the sequence and uses the final hidden state from the encoder to start generating the output sequence one word at a time.,4
351,What does the attention mechanism aim to solve in the seq2seq model?,The attention mechanism aims to solve the issue of the decoder focusing only on the final hidden state by allowing it to pay attention to different parts of the input sequence at each time step.,4
352,How does the attention mechanism improve the encoder-decoder architecture?,"Instead of feeding only the last hidden state of the encoder to the decoder, the attention mechanism feeds all hidden states into the decoder at each time step, with certain weightages (alpha) assigned to them.",4
353,What is a context vector in the context of the attention mechanism?,"A context vector is a weighted sum of all hidden states from the encoder, where the weights are determined by the attention mechanism.",4
354,What is the role of the alignment score in calculating attention weights?,"The alignment score, denoted as ei,je_{i,j}ei,j?, determines how important the jth word in the input sequence is for producing the ith word in the output sequence, based on the decoder's current state and the input word.",4
355,"How is the attention weight ?i,j\alpha_{i,j}?i,j? calculated from the alignment score?","The attention weight ?i,j\alpha_{i,j}?i,j? is calculated by applying a SoftMax function to the alignment score, ensuring that the weights sum to one, similar to a probability distribution.",4
356,What is the final purpose of the attention weights in the attention mechanism?,The attention weights determine how much focus the decoder should place on each input word when generating each output word in the sequence.,4
357,What is an API?,"An API (Application Programming Interface) is a set of functions and procedures that allows the creation of applications that access the features or data of an operating system, application, or other service.",4
358,What distinguishes Cognitive APIs from regular APIs?,"Cognitive APIs are specialized APIs that provide cognitive (data science) services, such as machine learning, natural language processing, and computer vision, often offered by cloud providers like Microsoft, Amazon, Google, IBM, and Twitter.",4
359,What are some key features of APIs?,"Key features of APIs include input/output mechanisms, rate limits, and authentication methods such as HTTP auth, API keys, and OAuth.",4
360,What is the role of an API key in API usage?,"An API key is a unique generated value assigned to each first-time user, signifying that the user is known and allowing them to access the API's services.",4
361,What are Vision APIs and give an example of one?,"Vision APIs are a type of Cognitive API focused on processing and analyzing visual data. An example is the Azure Computer Vision API, which can perform tasks like face detection and image recognition.",4
362,How does Azure's Face API handle face detection?,"Azure's Face API detects faces in images and returns data such as face attributes (age, gender, emotion), face landmarks (pupil positions, nose tip), and other characteristics like occlusion, exposure, and noise levels.",4
363,What is the purpose of the Immersive Reader API?,"The Immersive Reader API is designed to improve reading comprehension by providing features such as text decoding, highlighting, and voice narration, helping users with reading difficulties or those learning a new language.",4
